{
  "schema": "agentic-tech-lead/task-contract/v1",
  "task_id": "example-stack",
  "mode": "STACK",
  "subject": {
    "base_commit": "0123456789abcdef0123456789abcdef01234567",
    "base_tree": "89abcdef0123456789abcdef0123456789abcdef"
  },
  "goal": {
    "objective": "Add a bounded feature through contract, core, and integration layers.",
    "non_goals": ["No dependency upgrade", "No remote publication"]
  },
  "paths": {
    "write": ["feature/**", "tests/feature/**"],
    "read_only": ["shared/**", "package.json"],
    "forbidden": [".git/**", "secrets/**"],
    "changed": ["feature/contracts.py", "tests/feature/test_contracts.py"]
  },
  "architecture": {
    "interface_locks": [{"path": "shared/api.json", "sha256": "aaaaaaaaaaaaaaaaaaaaaaaaaaaaaaaaaaaaaaaaaaaaaaaaaaaaaaaaaaaaaaaa"}],
    "dependency_policy": "NO_NEW_DEPENDENCIES",
    "allowed_dependencies": [],
    "state_policy": "Reuse the existing state boundary; no new global store.",
    "no_double_graph": true
  },
  "case_obligations": {
    "case_graph_ref": "skills/spatial-loop-systems-engineering/tests/case-graph/fixtures/good.json",
    "case_graph_sha256": "4b7f2afac3ceaf1572a9d4f55cd3c1b3f6eb42bccd1fc39725fc44caa7b1d052",
    "required_case_ids": ["CASE-001", "CASE-002"],
    "branch_case_owners": [
      {"branch": "feature/contract", "case_ids": ["CASE-001"]},
      {"branch": "feature/core", "case_ids": ["CASE-002"]}
    ],
    "convergence_owner": "feature/core"
  },
  "providers": [
    {"id": "grepai", "role": "INTENT_ANCHOR", "state": "DEGRADED"},
    {"id": "scip-sqlite", "role": "DETERMINISTIC_GRAPH", "state": "EXACT", "subject": {"commit": "0123456789abcdef0123456789abcdef01234567", "tree": "89abcdef0123456789abcdef0123456789abcdef", "version": "example-1.0.0", "coverage_sha256": "bbbbbbbbbbbbbbbbbbbbbbbbbbbbbbbbbbbbbbbbbbbbbbbbbbbbbbbbbbbbbbbb", "source_readback": true}},
    {"id": "tree-sitter", "role": "STRUCTURAL_SLICER", "state": "EXACT", "subject": {"commit": "0123456789abcdef0123456789abcdef01234567", "tree": "89abcdef0123456789abcdef0123456789abcdef", "version": "example-1.0.0", "coverage_sha256": "bbbbbbbbbbbbbbbbbbbbbbbbbbbbbbbbbbbbbbbbbbbbbbbbbbbbbbbbbbbbbbbb", "source_readback": true}},
    {"id": "serena", "role": "AGENT_EXECUTOR", "state": "DEGRADED"},
    {"id": "lancedb", "role": "VECTOR_CANDIDATE_STORE", "state": "DEGRADED"}
  ],
  "branches": [
    {"name": "feature/contract", "parent": "main", "focus": "contract", "write": ["feature/contracts.py", "tests/feature/test_contracts.py"]},
    {"name": "feature/core", "parent": "feature/contract", "focus": "minimal-diff", "write": ["feature/core.py", "tests/feature/test_core.py"]}
  ],
  "acceptance": {
    "commands": [["python3", "-m", "unittest", "discover"]],
    "immutable_assertions": ["contract-signatures", "path-boundaries", "no-code-graph-rag", "case-obligation-coverage"]
  },
  "budgets": {"max_repairs_per_signature": 3, "max_workers": 2},
  "automation": {"git_town_admitted": true, "auto_restack": true, "auto_publish": false, "auto_resolve_conflicts": false, "auto_merge": false}
}
